{
  "schemaVersion": 1,
  "inventoryVersion": "legacy-media-raw-v1",
  "source": {
    "repository": "Xpotato1024/xpotato-site",
    "tag": "legacy-pre-vnext-2026-08-28",
    "tagObjectSha": "8503f5a50a5fb3d27a02422da0b50dc66c818b02",
    "commitSha": "927d105713561309fc5e2374396f86646b5aeb2a",
    "inventoryPayloadSha256": "9151be197d9e48a12297d45dfdd2a72a15cf9ce16f143fdc16b60e5345d37493"
  },
  "phase4MaterializationManifestPayloadSha256": "72ba1b79b550bb8e15ed68dfaa81d2ae8e730784497a96d419b32417a9f39fcb",
  "legacyInventoryPayloadSha256": "9151be197d9e48a12297d45dfdd2a72a15cf9ce16f143fdc16b60e5345d37493",
  "sourceContentCount": 53,
  "mediaPendingContentCount": 11,
  "uniqueLocatorCount": 15,
  "gitVerifiedLocatorCount": 13,
  "unresolvedLocatorCount": 2,
  "records": [
    {
      "legacyLocator": "/blog-placeholder-1.jpg",
      "likelyOrigin": "unknown",
      "referencedByLegacyContentIds": [
        "blog:anythingllm-fresh-thread-reembed-workspace",
        "blog:qdrant-on-disk-payload-windows-backed-storage",
        "blog:qdrant-rebuild-zero-vector-pitfall",
        "blog:repair-qdrant-corruption-anythingllm-smoke-test"
      ],
      "contentBindings": [
        {
          "legacyContentId": "blog:anythingllm-fresh-thread-reembed-workspace",
          "vNextContentId": "4ccd039f-2625-4f2b-83bb-fe248906ef96",
          "targetPath": "apps/site/src/content/blog/anythingllm-fresh-thread-reembed-workspace.mdx",
          "referenceKinds": [
            "frontmatter_hero_image"
          ],
          "roleHints": [
            "hero"
          ]
        },
        {
          "legacyContentId": "blog:qdrant-on-disk-payload-windows-backed-storage",
          "vNextContentId": "847e8fa9-d23d-492e-b616-dc294127a168",
          "targetPath": "apps/site/src/content/blog/qdrant-on-disk-payload-windows-backed-storage.mdx",
          "referenceKinds": [
            "frontmatter_hero_image"
          ],
          "roleHints": [
            "hero"
          ]
        },
        {
          "legacyContentId": "blog:qdrant-rebuild-zero-vector-pitfall",
          "vNextContentId": "522770a7-728f-4c28-896c-c7c84ebf3b20",
          "targetPath": "apps/site/src/content/blog/qdrant-rebuild-zero-vector-pitfall.mdx",
          "referenceKinds": [
            "frontmatter_hero_image"
          ],
          "roleHints": [
            "hero"
          ]
        },
        {
          "legacyContentId": "blog:repair-qdrant-corruption-anythingllm-smoke-test",
          "vNextContentId": "26abfd26-05cb-42f2-9224-5b16fbabf663",
          "targetPath": "apps/site/src/content/blog/repair-qdrant-corruption-anythingllm-smoke-test.mdx",
          "referenceKinds": [
            "frontmatter_hero_image"
          ],
          "roleHints": [
            "hero"
          ]
        }
      ],
      "rightsReviewStatus": "pending_human_review",
      "publicationStatus": "blocked",
      "recordPayloadSha256": "d25d422280675cfa74314964e2d981866945feb641a18b5eba24edca86ac9351",
      "verificationStatus": "unresolved_non_local",
      "unresolvedReason": "missing_git_object"
    },
    {
      "legacyLocator": "/images/projects/meidaisai-mac-cover.svg",
      "likelyOrigin": "project",
      "referencedByLegacyContentIds": [
        "projects:meidaisai-mac"
      ],
      "contentBindings": [
        {
          "legacyContentId": "projects:meidaisai-mac",
          "vNextContentId": "d87ec77e-e24e-4c5f-a5fe-a271eb6fc8da",
          "targetPath": "apps/site/src/content/projects/meidaisai-mac.mdx",
          "referenceKinds": [
            "frontmatter_cover_image"
          ],
          "roleHints": [
            "unresolved"
          ]
        }
      ],
      "rightsReviewStatus": "pending_human_review",
      "publicationStatus": "blocked",
      "recordPayloadSha256": "18aa942976f29713e82c689aae51e47025194f9f4b8157776fd69f30ffbdbc54",
      "verificationStatus": "git_verified",
      "repositoryPath": "public/images/projects/meidaisai-mac-cover.svg",
      "sourceFileSha256": "03c559cb7a8ae2a42ccaf15aaa557b406197214d96b3fe098de6040b4b05e3fb",
      "sizeBytes": 2012,
      "detectedFormat": "svg"
    },
    {
      "legacyLocator": "/images/projects/meidaisai-overview.png",
      "likelyOrigin": "project",
      "referencedByLegacyContentIds": [
        "projects:meidaisai-mac"
      ],
      "contentBindings": [
        {
          "legacyContentId": "projects:meidaisai-mac",
          "vNextContentId": "d87ec77e-e24e-4c5f-a5fe-a271eb6fc8da",
          "targetPath": "apps/site/src/content/projects/meidaisai-mac.mdx",
          "referenceKinds": [
            "frontmatter_overview_image"
          ],
          "roleHints": [
            "overview"
          ]
        }
      ],
      "rightsReviewStatus": "pending_human_review",
      "publicationStatus": "blocked",
      "recordPayloadSha256": "c23d013160b08aa59206d2f1dc9b916d87bf075502cf34f9c82b504f6d00db36",
      "verificationStatus": "git_verified",
      "repositoryPath": "public/images/projects/meidaisai-overview.png",
      "sourceFileSha256": "a8ac62ef3267d64032dd96ae2946e9ad3bf374bf911c32f0c8fafae56207532e",
      "sizeBytes": 392797,
      "detectedFormat": "png"
    },
    {
      "legacyLocator": "/images/projects/repo-audit-cover.svg",
      "likelyOrigin": "project",
      "referencedByLegacyContentIds": [
        "projects:repo-audit"
      ],
      "contentBindings": [
        {
          "legacyContentId": "projects:repo-audit",
          "vNextContentId": "d9a13e23-305d-4ba6-b4e0-5748fedd63fd",
          "targetPath": "apps/site/src/content/projects/repo-audit.mdx",
          "referenceKinds": [
            "frontmatter_cover_image"
          ],
          "roleHints": [
            "unresolved"
          ]
        }
      ],
      "rightsReviewStatus": "pending_human_review",
      "publicationStatus": "blocked",
      "recordPayloadSha256": "0d10fd876a0bcf18e533692e03ce1268ed4ad3ca5efbc9ce68d88014a0060b2d",
      "verificationStatus": "git_verified",
      "repositoryPath": "public/images/projects/repo-audit-cover.svg",
      "sourceFileSha256": "b586a06e69b3ebbe2b7bca815a68f2ae952aa873483fc2b2aeb4a2bd535bbc18",
      "sizeBytes": 2016,
      "detectedFormat": "svg"
    },
    {
      "legacyLocator": "/images/projects/repo-audit-overview.svg",
      "likelyOrigin": "project",
      "referencedByLegacyContentIds": [
        "projects:repo-audit"
      ],
      "contentBindings": [
        {
          "legacyContentId": "projects:repo-audit",
          "vNextContentId": "d9a13e23-305d-4ba6-b4e0-5748fedd63fd",
          "targetPath": "apps/site/src/content/projects/repo-audit.mdx",
          "referenceKinds": [
            "frontmatter_overview_image"
          ],
          "roleHints": [
            "overview"
          ]
        }
      ],
      "rightsReviewStatus": "pending_human_review",
      "publicationStatus": "blocked",
      "recordPayloadSha256": "2a1ca16ba93cd73314ee883a2408d8c88612153fa2891b2cac21daa7867f037a",
      "verificationStatus": "git_verified",
      "repositoryPath": "public/images/projects/repo-audit-overview.svg",
      "sourceFileSha256": "5a24cdd75eee0af2f1ac44a14d3f1bd03b822d8098fb3dc2d1dd6bec98a830ac",
      "sizeBytes": 6935,
      "detectedFormat": "svg"
    },
    {
      "legacyLocator": "/images/projects/syu-katsu-management-cover.svg",
      "likelyOrigin": "project",
      "referencedByLegacyContentIds": [
        "projects:syu-katsu-management"
      ],
      "contentBindings": [
        {
          "legacyContentId": "projects:syu-katsu-management",
          "vNextContentId": "80b540c6-cddc-4214-8d96-61b70a86787a",
          "targetPath": "apps/site/src/content/projects/syu-katsu-management.mdx",
          "referenceKinds": [
            "frontmatter_cover_image"
          ],
          "roleHints": [
            "unresolved"
          ]
        }
      ],
      "rightsReviewStatus": "pending_human_review",
      "publicationStatus": "blocked",
      "recordPayloadSha256": "582dcc9db9981ae740dff00c88052c949850aa663dc2bb95282e8d28995e188b",
      "verificationStatus": "git_verified",
      "repositoryPath": "public/images/projects/syu-katsu-management-cover.svg",
      "sourceFileSha256": "0d016f3a6dd90585491825bfad38a99d09fc2c57a41de130939800384b9b5554",
      "sizeBytes": 1952,
      "detectedFormat": "svg"
    },
    {
      "legacyLocator": "/images/projects/syu-katsu-management-overview.png",
      "likelyOrigin": "project",
      "referencedByLegacyContentIds": [
        "projects:syu-katsu-management"
      ],
      "contentBindings": [
        {
          "legacyContentId": "projects:syu-katsu-management",
          "vNextContentId": "80b540c6-cddc-4214-8d96-61b70a86787a",
          "targetPath": "apps/site/src/content/projects/syu-katsu-management.mdx",
          "referenceKinds": [
            "frontmatter_overview_image"
          ],
          "roleHints": [
            "overview"
          ]
        }
      ],
      "rightsReviewStatus": "pending_human_review",
      "publicationStatus": "blocked",
      "recordPayloadSha256": "5d766fa5af0b87f75d5e2010b03bac6e575738973cd909ee00812421a8f05312",
      "verificationStatus": "git_verified",
      "repositoryPath": "public/images/projects/syu-katsu-management-overview.png",
      "sourceFileSha256": "970bf70f5b07ae780cc3b2d81709d87bab732e712f8545caca8a041b0acd5e9a",
      "sizeBytes": 480461,
      "detectedFormat": "png"
    },
    {
      "legacyLocator": "/images/projects/xpotato-site-cover.svg",
      "likelyOrigin": "project",
      "referencedByLegacyContentIds": [
        "projects:xpotato-site"
      ],
      "contentBindings": [
        {
          "legacyContentId": "projects:xpotato-site",
          "vNextContentId": "325e1e0e-acd3-469f-a27d-476cf84b48fc",
          "targetPath": "apps/site/src/content/projects/xpotato-site.mdx",
          "referenceKinds": [
            "frontmatter_cover_image"
          ],
          "roleHints": [
            "unresolved"